{
  "content_hash": "b6ab5caff4927c6cbe7bdb9d7a867463e542aae407443cc10c25d362fba9f568",
  "default_locale": "en",
  "extensions": [],
  "format": "world-forge.project",
  "format_version": 1,
  "profile": {
    "content_hash": "de17d92a8781a925ee26586d07c7f14f72a80b8153e517aaf3ebde67a97349b3",
    "format": "world-forge.creation_profile",
    "format_version": 1,
    "id": "action_framing_profile",
    "path": "profile.json"
  },
  "project_id": "action_framing",
  "project_kind": "game",
  "project_version": "1.0.0",
  "source_manifest": {
    "content_hash": "942f0078f72362503e7ac65c4622e8660e81ba47e15173a304c5b7d6848fec38",
    "format": "world-forge.creation_source_manifest",
    "format_version": 1,
    "id": "action_framing",
    "path": "source/manifest.json"
  },
  "title": "Action Framing"
}
